source,native,name,p_value,significant,description,term_size,query_size,intersection_size,effective_domain_size,precision,recall,query,parents
GO:BP,GO:0044267,cellular protein metabolic process,1.3850033959269175e-10,True,"""The chemical reactions and pathways involving a specific protein, rather than of proteins in general, occurring at the level of an individual cell. Includes cellular protein modification."" [GOC:jl]",5324,9637,3100,17847,0.32167687039535126,0.5822689706987227,query_1,"['GO:0044260', 'GO:0019538']"
GO:MF,GO:0015318,inorganic molecular entity transmembrane transporter activity,1.8607713051277599e-10,True,"""Enables the transfer of an inorganic molecular entity from the outside of a cell to the inside of the cell across a membrane. An inorganic molecular entity is a molecular entity that contains no carbon."" [GOC:mtg_transport, ISBN:0815340729]",823,9902,549,18098,0.05544334477883256,0.6670716889428918,query_1,['GO:0022857']
GO:MF,GO:0031267,small GTPase binding,1.944047916104609e-10,True,"""Interacting selectively and non-covalently with a small monomeric GTPase."" [GOC:mah]",446,9902,317,18098,0.03201373459907089,0.7107623318385651,query_1,['GO:0051020']
GO:BP,GO:0048522,positive regulation of cellular process,1.952096576035108e-10,True,"""Any process that activates or increases the frequency, rate or extent of a cellular process, any of those that are carried out at the cellular level, but are not necessarily restricted to a single cell. For example, cell communication occurs among more than one cell, but occurs at the cellular level."" [GOC:jid]",5515,9637,3204,17847,0.33246861056345334,0.5809610154125113,query_1,"['GO:0050794', 'GO:0048518', 'GO:0009987']"
GO:MF,GO:0004674,protein serine/threonine kinase activity,2.112718656096049e-10,True,"""Catalysis of the reactions: ATP + protein serine = ADP + protein serine phosphate, and ATP + protein threonine = ADP + protein threonine phosphate."" [GOC:bf]",443,9902,315,18098,0.0318117552009695,0.7110609480812641,query_1,['GO:0004672']
GO:BP,GO:0030031,cell projection assembly,2.18135271374171e-10,True,"""Formation of a prolongation or process extending from a cell, e.g. a flagellum or axon."" [GOC:jl, GOC:mah, http://www.cogsci.princeton.edu/~wn/]",572,9637,394,17847,0.04088409255992529,0.6888111888111889,query_1,"['GO:0022607', 'GO:0030030']"
GO:CC,GO:0098793,presynapse,2.486536130363379e-10,True,"""The part of a synapse that is part of the presynaptic cell."" [GOC:dos]",516,10070,354,18842,0.03515392254220457,0.686046511627907,query_1,"['GO:0097458', 'GO:0044456']"
GO:BP,GO:0051056,regulation of small GTPase mediated signal transduction,2.500902200722061e-10,True,"""Any process that modulates the frequency, rate or extent of small GTPase mediated signal transduction."" [GOC:go_curators]",343,9637,251,17847,0.026045449828784893,0.7317784256559767,query_1,"['GO:1902531', 'GO:0007264']"
GO:CC,GO:0045177,apical part of cell,2.9207470531758057e-10,True,"""The region of a polarized cell that forms a tip or is distal to a base. For example, in a polarized epithelial cell, the apical region has an exposed surface and lies opposite to the basal lamina that separates the epithelium from other tissue."" [GOC:mah, ISBN:0815316194]",396,10070,280,18842,0.027805362462760674,0.7070707070707071,query_1,['GO:0044464']
GO:CC,GO:0005634,nucleus,3.4184320067427645e-10,True,"""A membrane-bounded organelle of eukaryotic cells in which chromosomes are housed and replicated. In most cells, the nucleus contains all of the cell's chromosomes except the organellar chromosomes, and is the site of RNA synthesis and processing. In some species, or in specialized cell types, RNA metabolism or DNA replication may be absent."" [GOC:go_curators]",7445,10070,4214,18842,0.41847070506454814,0.5660174613834789,query_1,['GO:0043231']
GO:BP,GO:0099537,trans-synaptic signaling,4.043395338975419e-10,True,"""Cell-cell signaling in either direction across the synaptic cleft."" [GOC:dos]",715,9637,480,17847,0.049808031545086645,0.6713286713286714,query_1,['GO:0099536']
GO:BP,GO:0120031,plasma membrane bounded cell projection assembly,4.29936965225495e-10,True,"""Formation of a prolongation or process extending and that is bounded by plasma membrane, e.g. a cilium, lamellipodium, or axon."" [GOC:krc]",559,9637,385,17847,0.039950191968454916,0.6887298747763864,query_1,"['GO:0120036', 'GO:0030031']"
GO:BP,GO:0065009,regulation of molecular function,4.674880767340117e-10,True,"""Any process that modulates the frequency, rate or extent of a molecular function, an elemental biological activity occurring at the molecular level, such as catalysis or binding."" [GOC:isa_complete]",3013,9637,1807,17847,0.1875064854207741,0.5997344839030866,query_1,['GO:0065007']
GO:CC,GO:0031226,intrinsic component of plasma membrane,4.931783325960673e-10,True,"""The component of the plasma membrane consisting of the gene products and protein complexes having either part of their peptide sequence embedded in the hydrophobic region of the membrane or some other covalently attached group such as a GPI anchor that is similarly embedded in the membrane."" [GOC:dos, GOC:mah]",1744,10070,1070,18842,0.10625620655412116,0.6135321100917431,query_1,"['GO:0044459', 'GO:0031224']"
GO:CC,GO:0005815,microtubule organizing center,5.338672425289669e-10,True,"""An intracellular structure that can catalyze gamma-tubulin-dependent microtubule nucleation and that can anchor microtubules by interacting with their minus ends, plus ends or sides."" [GOC:vw, http://en.wikipedia.org/wiki/Microtubule_organizing_center, ISBN:0815316194, PMID:17072892, PMID:17245416]",751,10070,494,18842,0.04905660377358491,0.6577896138482024,query_1,"['GO:0015630', 'GO:0044430']"
GO:CC,GO:0005912,adherens junction,5.55609585727588e-10,True,"""A cell junction at which anchoring proteins (cadherins or integrins) extend through the plasma membrane and are attached to actin filaments."" [GOC:mah, ISBN:0198506732]",546,10070,371,18842,0.03684210526315789,0.6794871794871795,query_1,['GO:0070161']
GO:BP,GO:0044085,cellular component biogenesis,6.496300852850748e-10,True,"""A process that results in the biosynthesis of constituent macromolecules, assembly, and arrangement of constituent parts of a cellular component. Includes biosynthesis of constituent macromolecules, and those macromolecular modifications that are involved in synthesis or assembly of the cellular component."" [GOC:jl, GOC:mah]",3253,9637,1941,17847,0.20141122756044413,0.5966799877036582,query_1,['GO:0071840']
GO:BP,GO:0048518,positive regulation of biological process,6.568101250870003e-10,True,"""Any process that activates or increases the frequency, rate or extent of a biological process. Biological processes are regulated by many means; examples include the control of gene expression, protein modification or interaction with a protein or substrate molecule."" [GOC:jid]",6290,9637,3625,17847,0.3761544048977898,0.5763116057233705,query_1,"['GO:0050789', 'GO:0008150']"
GO:BP,GO:0050790,regulation of catalytic activity,7.728401762067355e-10,True,"""Any process that modulates the activity of an enzyme."" [GOC:ai, GOC:ebc, GOC:vw]",2338,9637,1423,17847,0.1476600601847048,0.6086398631308811,query_1,['GO:0065009']
GO:CC,GO:0099568,cytoplasmic region,8.08247293114608e-10,True,"""Any (proper) part of the cytoplasm of a single cell of sufficient size to still be considered cytoplasm\"""" [GOC:dos]",514,10070,351,18842,0.034856007944389276,0.6828793774319066,query_1,"['GO:0005737', 'GO:0044444']"
GO:BP,GO:0055085,transmembrane transport,8.279963306999472e-10,True,"""The process in which a solute is transported across a lipid bilayer, from one side of a membrane to the other."" [GOC:dph, GOC:jid]",1625,9637,1014,17847,0.10521946663899553,0.624,query_1,['GO:0006810']
GO:BP,GO:0006810,transport,8.717958128056191e-10,True,"""The directed movement of substances (such as macromolecules, small molecules, ions) or cellular components (such as complexes and organelles) into, out of or within a cell, or between cells, or within a multicellular organism by means of some agent such as a transporter, pore or motor protein."" [GOC:dos, GOC:dph, GOC:jl, GOC:mah]",5296,9637,3077,17847,0.3192902355504825,0.5810045317220544,query_1,['GO:0051234']
GO:CC,GO:0005887,integral component of plasma membrane,8.963830043696676e-10,True,"""The component of the plasma membrane consisting of the gene products and protein complexes having at least some part of their peptide sequence embedded in the hydrophobic region of the membrane."" [GOC:dos, GOC:go_curators]",1668,10070,1025,18842,0.10178748758689175,0.6145083932853717,query_1,"['GO:0031226', 'GO:0016021']"
GO:BP,GO:0099536,synaptic signaling,9.329713312543564e-10,True,"""Cell-cell signaling to, from or or within a synapse."" [GOC:dos]",734,9637,490,17847,0.050845698868942614,0.667574931880109,query_1,['GO:0007267']
GO:CC,GO:0070161,anchoring junction,1.0926412912511976e-09,True,"""A cell junction that mechanically attaches a cell (and its cytoskeleton) to neighboring cells or to the extracellular matrix."" [ISBN:0815332181]",561,10070,379,18842,0.037636544190665346,0.6755793226381461,query_1,['GO:0030054']
GO:CC,GO:0031982,vesicle,1.210081083765846e-09,True,"""Any small, fluid-filled, spherical organelle enclosed by membrane."" [GOC:mah, GOC:pz, GOC:vesicles]",3891,10070,2269,18842,0.2253227408142999,0.5831405808275507,query_1,['GO:0043227']
GO:BP,GO:0019752,carboxylic acid metabolic process,1.4462120571334064e-09,True,"""The chemical reactions and pathways involving carboxylic acids, any organic acid containing one or more carboxyl (COOH) groups or anions (COO-)."" [ISBN:0198506732]",1075,9637,692,17847,0.07180657881083324,0.6437209302325582,query_1,['GO:0043436']
GO:BP,GO:0048869,cellular developmental process,1.7221535374282299e-09,True,"""A biological process whose specific outcome is the progression of a cell over time from an initial condition to a later condition."" [GOC:isa_complete]",4470,9637,2617,17847,0.27155753865310783,0.5854586129753915,query_1,"['GO:0009987', 'GO:0032502']"
GO:BP,GO:0098916,anterograde trans-synaptic signaling,1.7804665801209779e-09,True,"""Cell-cell signaling from pre to post-synapse, across the synaptic cleft"" [GOC:dos]",706,9637,472,17847,0.048977897686001866,0.6685552407932012,query_1,['GO:0099537']
GO:BP,GO:0007268,chemical synaptic transmission,1.7804665801209779e-09,True,"""The vesicular release of classical neurotransmitter molecules from a presynapse, across a chemical synapse, the subsequent activation of neurotransmitter receptors at the postsynapse of a target cell (neuron, muscle, or secretory cell) and the effects of this activation on the postsynaptic membrane potential and ionic composition of the postsynaptic cytosol. This process encompasses both spontaneous and evoked release of neurotransmitter and all parts of synaptic vesicle exocytosis. Evoked transmission starts with the arrival of an action potential at the presynapse."" [GOC:jl, MeSH:D009435]",706,9637,472,17847,0.048977897686001866,0.6685552407932012,query_1,['GO:0098916']
GO:BP,GO:0099003,vesicle-mediated transport in synapse,1.962761980670962e-09,True,"""Any vesicle-mediated transport that occurs in a synapse"" [GOC:dos]",218,9637,168,17847,0.017432811040780326,0.7706422018348624,query_1,['GO:0016192']
GO:MF,GO:0019900,kinase binding,2.094612536536939e-09,True,"""Interacting selectively and non-covalently with a kinase, any enzyme that catalyzes the transfer of a phosphate group."" [GOC:jl]",733,9902,490,18098,0.04948495253484145,0.6684856753069577,query_1,['GO:0019899']
GO:MF,GO:0005215,transporter activity,2.097740516263131e-09,True,"""Enables the directed movement of substances (such as macromolecules, small molecules, ions) into, out of or within a cell, or between cells."" [GOC:ai, GOC:dgf]",1215,9902,778,18098,0.07856998586144213,0.6403292181069958,query_1,['GO:0003674']
GO:MF,GO:0017016,Ras GTPase binding,2.5855656644274643e-09,True,"""Interacting selectively and non-covalently with any member of the Ras superfamily of monomeric GTPases."" [GOC:mah]",431,9902,304,18098,0.030700868511411836,0.7053364269141531,query_1,['GO:0031267']
GO:CC,GO:0031090,organelle membrane,3.0653494496044776e-09,True,"""A membrane that is one of the two lipid bilayers of an organelle envelope or the outermost membrane of single membrane bound organelle."" [GOC:dos, GOC:mah]",3500,10070,2049,18842,0.20347567030784508,0.5854285714285714,query_1,"['GO:0016020', 'GO:0043227', 'GO:0044422']"
GO:MF,GO:0046873,metal ion transmembrane transporter activity,3.0787643883769427e-09,True,"""Enables the transfer of metal ions from one side of a membrane to the other."" [GOC:ai]",449,9902,315,18098,0.0318117552009695,0.7015590200445434,query_1,['GO:0022890']
GO:BP,GO:0007267,cell-cell signaling,3.978798643272528e-09,True,"""Any process that mediates the transfer of information from one cell to another. This process includes signal transduction in the receiving cell and, where applicable, release of a ligand and any processes that actively facilitate its transport and presentation to the receiving cell.  Examples include signaling via soluble ligands, via cell adhesion molecules and via gap junctions."" [GOC:dos, GOC:mah]",1679,9637,1041,17847,0.10802116841340666,0.620011911852293,query_1,"['GO:0007154', 'GO:0023052']"
GO:BP,GO:0051960,regulation of nervous system development,4.197863949008561e-09,True,"""Any process that modulates the frequency, rate or extent of nervous system development, the origin and formation of nervous tissue."" [GOC:ai]",945,9637,613,17847,0.06360900695237107,0.6486772486772486,query_1,"['GO:2000026', 'GO:0007399']"
GO:BP,GO:0043436,oxoacid metabolic process,4.34804782629744e-09,True,"""The chemical reactions and pathways involving any oxoacid; an oxoacid is a compound which contains oxygen, at least one other element, and at least one hydrogen bound to oxygen, and which produces a conjugate base by loss of positive hydrogen ion(s) (hydrons)."" [CHEBI:24833]",1166,9637,743,17847,0.0770986821624987,0.6372212692967409,query_1,['GO:0006082']
GO:MF,GO:0051020,GTPase binding,5.617722179051109e-09,True,"""Interacting selectively and non-covalently with a GTPase, any enzyme that catalyzes the hydrolysis of GTP."" [GOC:ai]",549,9902,376,18098,0.03797212684306201,0.6848816029143898,query_1,['GO:0019899']
GO:MF,GO:0019904,protein domain specific binding,5.681293706664046e-09,True,"""Interacting selectively and non-covalently with a specific domain of a protein."" [GOC:go_curators]",708,9902,473,18098,0.0477681276509796,0.6680790960451978,query_1,['GO:0005515']
GO:BP,GO:0006082,organic acid metabolic process,5.90291002422202e-09,True,"""The chemical reactions and pathways involving organic acids, any acidic compound containing carbon in covalent linkage."" [ISBN:0198506732]",1186,9637,754,17847,0.07824011621874027,0.6357504215851602,query_1,"['GO:0044237', 'GO:0044281', 'GO:0071704']"
GO:MF,GO:0022857,transmembrane transporter activity,6.966662277328937e-09,True,"""Enables the transfer of a substance, usually a specific substance or a group of related substances, from one side of a membrane to the other."" [GOC:jid, GOC:mtg_transport, ISBN:0815340729]",1066,9902,687,18098,0.06937992324782873,0.6444652908067542,query_1,['GO:0005215']
GO:BP,GO:0018193,peptidyl-amino acid modification,7.4013941680493766e-09,True,"""The alteration of an amino acid residue in a peptide."" [GOC:mah]",1276,9637,806,17847,0.08363598630279133,0.6316614420062696,query_1,['GO:0006464']
GO:MF,GO:0008324,cation transmembrane transporter activity,8.118934262561275e-09,True,"""Enables the transfer of cation from one side of a membrane to the other."" [GOC:dgf, GOC:mtg_transport, ISBN:0815340729]",658,9902,442,18098,0.044637446980407995,0.6717325227963525,query_1,['GO:0015075']
GO:BP,GO:0022604,regulation of cell morphogenesis,8.438686686676016e-09,True,"""Any process that modulates the frequency, rate or extent of cell morphogenesis. Cell morphogenesis is the developmental process in which the shape of a cell is generated and organized."" [GOC:isa_complete]",493,9637,340,17847,0.03528068901110304,0.6896551724137931,query_1,"['GO:0022603', 'GO:0051128', 'GO:0000902']"
GO:BP,GO:0034220,ion transmembrane transport,9.004741495509467e-09,True,"""A process in which an ion is transported across a membrane."" [GOC:mah]",1174,9637,746,17847,0.07740998235965549,0.6354344122657581,query_1,"['GO:0055085', 'GO:0006811']"
GO:BP,GO:0030029,actin filament-based process,9.195345781936407e-09,True,"""Any cellular process that depends upon or alters the actin cytoskeleton, that part of the cytoskeleton comprising actin filaments and their associated proteins."" [GOC:mah]",771,9637,508,17847,0.05271350005188337,0.6588845654993515,query_1,['GO:0009987']
GO:BP,GO:0042391,regulation of membrane potential,9.980153608023556e-09,True,"""Any process that modulates the establishment or extent of a membrane potential, the electric potential existing across any membrane arising from charges in the membrane itself and from the charges present in the media on either side of the membrane."" [GOC:jl, GOC:mtg_cardio, GOC:tb, ISBN:0198506732]",435,9637,304,17847,0.03154508664522154,0.6988505747126437,query_1,['GO:0065008']
GO:CC,GO:0012506,vesicle membrane,1.0758095818054953e-08,True,"""The lipid bilayer surrounding any membrane-bounded vesicle in the cell."" [GOC:mah, GOC:vesicle]",798,10070,516,18842,0.05124131082423039,0.6466165413533834,query_1,"['GO:0031090', 'GO:0031982']"
GO:MF,GO:0035091,phosphatidylinositol binding,1.2360183613846954e-08,True,"""Interacting selectively and non-covalently with any inositol-containing glycerophospholipid, i.e. phosphatidylinositol (PtdIns) and its phosphorylated derivatives."" [GOC:bf, ISBN:0198506732, PMID:11395417]",244,9902,183,18098,0.01848111492627752,0.75,query_1,['GO:0005543']
GO:BP,GO:0010975,regulation of neuron projection development,1.4313610045698043e-08,True,"""Any process that modulates the rate, frequency or extent of neuron projection development. Neuron projection development is the process whose specific outcome is the progression of a neuron projection over time, from its formation to the mature structure. A neuron projection is any process extending from a neural cell, such as axons or dendrites (collectively called neurites)."" [GOC:dph, GOC:tb]",509,9637,349,17847,0.03621458960257341,0.6856581532416502,query_1,"['GO:0045664', 'GO:0031175', 'GO:0120035']"
GO:BP,GO:0048667,cell morphogenesis involved in neuron differentiation,1.6135637520444098e-08,True,"""The process in which the structures of a neuron are generated and organized. This process occurs while the initially relatively unspecialized cell is acquiring the specialized features of a neuron."" [GOC:dph, GOC:tb]",603,9637,406,17847,0.042129293348552456,0.6733001658374793,query_1,"['GO:0000904', 'GO:0048666']"
GO:BP,GO:0050767,regulation of neurogenesis,1.6184438483213564e-08,True,"""Any process that modulates the frequency, rate or extent of neurogenesis, the generation of cells in the nervous system."" [GOC:ai]",840,9637,548,17847,0.05686416934730725,0.6523809523809524,query_1,"['GO:0051960', 'GO:0060284', 'GO:0022008', 'GO:0048699']"
GO:BP,GO:0045664,regulation of neuron differentiation,1.6360548552840096e-08,True,"""Any process that modulates the frequency, rate or extent of neuron differentiation."" [GOC:go_curators]",671,9637,447,17847,0.04638372937636194,0.6661698956780924,query_1,"['GO:0050767', 'GO:0030182']"
GO:BP,GO:0010604,positive regulation of macromolecule metabolic process,1.6664270919646742e-08,True,"""Any process that increases the frequency, rate or extent of the chemical reactions and pathways involving macromolecules, any molecule of high relative molecular mass, the structure of which essentially comprises the multiple repetition of units derived, actually or conceptually, from molecules of low relative molecular mass."" [GOC:dph, GOC:tb]",3397,9637,2010,17847,0.20857113209505032,0.59169855755078,query_1,"['GO:0009893', 'GO:0060255', 'GO:0043170']"
GO:CC,GO:0015629,actin cytoskeleton,1.690049419739034e-08,True,"""The part of the cytoskeleton (the internal framework of a cell) composed of actin and associated proteins. Includes actin cytoskeleton-associated complexes."" [GOC:jl, ISBN:0395825172, ISBN:0815316194]",517,10070,348,18842,0.03455809334657398,0.6731141199226306,query_1,['GO:0005856']
GO:BP,GO:0060341,regulation of cellular localization,1.7997783379264753e-08,True,"""Any process that modulates the frequency, rate or extent of a process in which a cell, a substance, or a cellular entity is transported to, or maintained in a specific location within or in the membrane of a cell."" [GOC:dph, GOC:tb]",918,9637,594,17847,0.061637439037044724,0.6470588235294118,query_1,"['GO:0032879', 'GO:0051641']"
GO:BP,GO:0051239,regulation of multicellular organismal process,1.9902701069796663e-08,True,"""Any process that modulates the frequency, rate or extent of a multicellular organismal process, the processes pertinent to the function of a multicellular organism above the cellular level; includes the integrated processes of tissues and organs."" [GOC:ai, GOC:dph, GOC:tb]",3300,9637,1955,17847,0.20286396181384247,0.5924242424242424,query_1,"['GO:0050789', 'GO:0032501']"
GO:BP,GO:0032879,regulation of localization,2.2337164206239003e-08,True,"""Any process that modulates the frequency, rate or extent of any process in which a cell, a substance, or a cellular entity is transported to, or maintained in, a specific location."" [GOC:mah]",2893,9637,1726,17847,0.17910138009754073,0.5966125129623229,query_1,"['GO:0051179', 'GO:0050789']"
GO:MF,GO:0005543,phospholipid binding,2.4591540033164028e-08,True,"""Interacting selectively and non-covalently with phospholipids, a class of lipids containing phosphoric acid as a mono- or diester."" [ISBN:0198506732]",425,9902,297,18098,0.029993940618056956,0.6988235294117647,query_1,"['GO:0008289', 'GO:0043168']"
GO:CC,GO:0005929,cilium,2.7752318757144876e-08,True,"""A specialized eukaryotic organelle that consists of a filiform extrusion of the cell surface and of some cytoplasmic parts. Each cilium is largely bounded by an extrusion of the cytoplasmic (plasma) membrane, and contains a regular longitudinal array of microtubules, anchored to a basal body."" [GOC:cilia, GOC:curators, GOC:kmv, GOC:vw, ISBN:0198547684, PMID:16824949, PMID:17009929, PMID:20144998]",627,10070,413,18842,0.041012909632571995,0.6586921850079744,query_1,"['GO:0043226', 'GO:0120025']"
GO:BP,GO:0007169,transmembrane receptor protein tyrosine kinase signaling pathway,3.080256139740017e-08,True,"""A series of molecular signals initiated by the binding of an extracellular ligand to a receptor on the surface of the target cell where the receptor possesses tyrosine kinase activity, and ending with regulation of a downstream cellular process, e.g. transcription."" [GOC:ceb, GOC:signaling]",733,9637,483,17847,0.050119331742243436,0.6589358799454298,query_1,['GO:0007167']
GO:BP,GO:0006811,ion transport,3.246950363561464e-08,True,"""The directed movement of charged atoms or small charged molecules into, out of or within a cell, or between cells, by means of some agent such as a transporter or pore."" [GOC:ai]",1717,9637,1057,17847,0.10968143613157622,0.615608619685498,query_1,['GO:0006810']
GO:MF,GO:0050839,cell adhesion molecule binding,3.7340094866142096e-08,True,"""Interacting selectively and non-covalently with a cell adhesion molecule."" [GOC:ai]",502,9902,344,18098,0.03474045647343971,0.6852589641434262,query_1,['GO:0005515']
GO:BP,GO:0048731,system development,3.972820499483452e-08,True,"""The process whose specific outcome is the progression of an organismal system over time, from its formation to the mature structure. A system is a regularly interacting or interdependent group of organs or tissues that work together to carry out a given biological process."" [GOC:dph, GOC:jid]",4967,9637,2879,17847,0.29874442253813427,0.579625528488021,query_1,"['GO:0007275', 'GO:0048856']"
GO:BP,GO:0007167,enzyme linked receptor protein signaling pathway,3.982462988288737e-08,True,"""Any series of molecular signals initiated by the binding of an extracellular ligand to a receptor on the surface of the target cell, where the receptor possesses catalytic activity or is closely associated with an enzyme such as a protein kinase, and ending with regulation of a downstream cellular process, e.g. transcription."" [GOC:mah, GOC:signaling, ISBN:0815316194]",1062,9637,677,17847,0.07025007782504929,0.6374764595103578,query_1,['GO:0007166']
GO:MF,GO:0019901,protein kinase binding,4.084306254793405e-08,True,"""Interacting selectively and non-covalently with a protein kinase, any enzyme that catalyzes the transfer of a phosphate group, usually from ATP, to a protein substrate."" [GOC:jl]",653,9902,436,18098,0.04403150878610382,0.667687595712098,query_1,['GO:0019900']
GO:MF,GO:0005216,ion channel activity,4.474464696184247e-08,True,"""Enables the facilitated diffusion of an ion (by an energy-independent process) by passage through a transmembrane aqueous pore or channel without evidence for a carrier-mediated mechanism. May be either selective (it enables passage of a specific ion only) or non-selective (it enables passage of two or more ions of same charge but different size)."" [GOC:cy, GOC:mtg_transport, GOC:pr, ISBN:0815340729]",420,9902,293,18098,0.02958998182185417,0.6976190476190476,query_1,"['GO:0015267', 'GO:0015318', 'GO:0015075']"
GO:CC,GO:0034702,ion channel complex,4.584415274173973e-08,True,"""A protein complex that spans a membrane and forms a water-filled channel across the phospholipid bilayer allowing selective ion transport down its electrochemical gradient."" [GOC:mah, ISBN:071673706X]",302,10070,215,18842,0.02135054617676266,0.7119205298013245,query_1,['GO:1902495']
