source,native,name,p_value,significant,description,term_size,query_size,intersection_size,effective_domain_size,precision,recall,query,parents
GO:BP,GO:0043087,regulation of GTPase activity,3.0817116460664546e-06,True,"""Any process that modulates the rate of GTP hydrolysis by a GTPase."" [GOC:jl, GOC:mah]",479,9637,322,17847,0.03341288782816229,0.6722338204592901,query_1,['GO:0051336']
GO:BP,GO:0033043,regulation of organelle organization,3.0881399280700985e-06,True,"""Any process that modulates the frequency, rate or extent of a process involved in the formation, arrangement of constituent parts, or disassembly of an organelle."" [GOC:mah]",1284,9637,795,17847,0.08249455224654975,0.6191588785046729,query_1,"['GO:0051128', 'GO:0006996']"
GO:MF,GO:0015081,sodium ion transmembrane transporter activity,3.1246866487029494e-06,True,"""Enables the transfer of sodium ions (Na+) from one side of a membrane to the other."" [GOC:ai, GOC:BHF]",155,9902,119,18098,0.012017774187032922,0.7677419354838709,query_1,"['GO:0015077', 'GO:0046873']"
GO:MF,GO:0022804,active transmembrane transporter activity,3.1742225652403757e-06,True,"""Enables the transfer of a specific substance or related group of substances from one side of a membrane to the other, up the solute's concentration gradient. The transporter binds the solute and undergoes a series of conformational changes. Transport works equally well in either direction."" [GOC:mtg_transport, ISBN:0815340729]",366,9902,253,18098,0.025550393859826298,0.6912568306010929,query_1,['GO:0022857']
GO:BP,GO:0033674,positive regulation of kinase activity,3.368739769265744e-06,True,"""Any process that activates or increases the frequency, rate or extent of kinase activity, the catalysis of the transfer of a phosphate group, usually from ATP, to a substrate molecule."" [GOC:mah]",579,9637,382,17847,0.039638891771298125,0.6597582037996546,query_1,"['GO:0051347', 'GO:0043549', 'GO:0042327']"
GO:BP,GO:0061564,axon development,3.3763497836117522e-06,True,"""The progression of an axon over time. Covers axonogenesis (de novo generation of an axon) and axon regeneration (regrowth), as well as processes pertaining to the progression of the axon over time (fasciculation and defasciculation)."" [GOC:dph, GOC:pg, GOC:pr]",529,9637,352,17847,0.036525889799730205,0.665406427221172,query_1,['GO:0031175']
GO:BP,GO:0046777,protein autophosphorylation,3.964058734767566e-06,True,"""The phosphorylation by a protein of one or more of its own amino acid residues (cis-autophosphorylation), or residues on an identical protein (trans-autophosphorylation)."" [ISBN:0198506732]",235,9637,171,17847,0.017744111237937118,0.7276595744680852,query_1,['GO:0006468']
GO:CC,GO:0099699,integral component of synaptic membrane,4.4054046771907375e-06,True,"""The component of the synaptic membrane consisting of the gene products and protein complexes having at least some part of their peptide sequence embedded in the hydrophobic region of the membrane."" [GOC:dos]",157,10070,118,18842,0.011717974180734857,0.7515923566878981,query_1,"['GO:0005887', 'GO:0099240']"
GO:MF,GO:0017048,Rho GTPase binding,4.745305660147091e-06,True,"""Interacting selectively and non-covalently with Rho protein, any member of the Rho subfamily of the Ras superfamily of monomeric GTPases. Proteins in the Rho subfamily are involved in relaying signals from cell-surface receptors to the actin cytoskeleton."" [ISBN:0198547684, PMID:12581856]",177,9902,133,18098,0.013431629973742679,0.751412429378531,query_1,['GO:0017016']
GO:BP,GO:0034330,cell junction organization,5.7500580365375585e-06,True,"""A process that is carried out at the cellular level which results in the assembly, arrangement of constituent parts, or disassembly of a cell junction. A cell junction is a specialized region of connection between two cells or between a cell and the extracellular matrix."" [GOC:dph, GOC:jl, GOC:mah]",293,9637,207,17847,0.021479713603818614,0.7064846416382252,query_1,['GO:0016043']
GO:MF,GO:0042802,identical protein binding,6.608011127276305e-06,True,"""Interacting selectively and non-covalently with an identical protein or proteins."" [GOC:jl]",1758,9902,1071,18098,0.1081599676832963,0.6092150170648464,query_1,['GO:0005515']
GO:BP,GO:0019220,regulation of phosphate metabolic process,7.376232983123437e-06,True,"""Any process that modulates the frequency, rate or extent of the chemical reactions and pathways involving phosphates."" [GOC:go_curators]",1827,9637,1103,17847,0.11445470582131369,0.6037219485495348,query_1,"['GO:0051174', 'GO:0006796']"
GO:BP,GO:0051174,regulation of phosphorus metabolic process,7.681217118986521e-06,True,"""Any process that modulates the frequency, rate or extent of the chemical reactions and pathways involving phosphorus or compounds containing phosphorus."" [GOC:ai]",1829,9637,1104,17847,0.11455847255369929,0.6036085292509568,query_1,"['GO:0031323', 'GO:0006793']"
GO:MF,GO:0022803,passive transmembrane transporter activity,7.682728064788046e-06,True,"""Enables the transfer of a single solute from one side of a membrane to the other by a mechanism involving conformational change, either by facilitated diffusion or in a membrane potential dependent process if the solute is charged."" [GOC:mtg_transport, ISBN:0815340729]",463,9902,311,18098,0.031407796404766715,0.67170626349892,query_1,['GO:0022857']
GO:BP,GO:0051347,positive regulation of transferase activity,8.633518077464841e-06,True,"""Any process that activates or increases the frequency, rate or extent of transferase activity, the catalysis of the transfer of a group, e.g. a methyl group, glycosyl group, acyl group, phosphorus-containing, or other groups, from a donor compound to an acceptor."" [GOC:ai]",656,9637,426,17847,0.0442046279962644,0.649390243902439,query_1,"['GO:0043085', 'GO:0051338']"
GO:MF,GO:0015267,channel activity,9.529376997486871e-06,True,"""Enables the energy-independent facilitated diffusion, mediated by passage of a solute through a transmembrane aqueous pore or channel. Stereospecificity is not exhibited but this transport may be specific for a particular molecular species or class of molecules."" [GOC:mtg_transport, ISBN:0815340729, TC:1.-.-.-.-]",462,9902,310,18098,0.03130680670571602,0.670995670995671,query_1,['GO:0022803']
GO:BP,GO:0051171,regulation of nitrogen compound metabolic process,1.0079340580285812e-05,True,"""Any process that modulates the frequency, rate or extent of the chemical reactions and pathways involving nitrogen or nitrogenous compounds."" [GOC:ai, GOC:tb]",5916,9637,3374,17847,0.35010895506900486,0.5703177822853279,query_1,"['GO:0006807', 'GO:0019222']"
GO:CC,GO:0005874,microtubule,1.0545096877625478e-05,True,"""Any of the long, generally straight, hollow tubes of internal diameter 12-15 nm and external diameter 24 nm found in a wide variety of eukaryotic cells; each consists (usually) of 13 protofilaments of polymeric tubulin, staggered in such a manner that the tubulin monomers are arranged in a helical pattern on the microtubular surface, and with the alpha/beta axes of the tubulin subunits parallel to the long axis of the tubule; exist in equilibrium with pool of tubulin monomers and can be rapidly assembled or disassembled in response to physiological stimuli; concerned with force generation, e.g. in the spindle."" [ISBN:0879693568]",422,10070,280,18842,0.027805362462760674,0.6635071090047393,query_1,"['GO:0099513', 'GO:0015630']"
GO:BP,GO:0007049,cell cycle,1.1281176482767129e-05,True,"""The progression of biochemical and morphological phases and events that occur in a cell during successive cell replication or nuclear replication events. Canonically, the cell cycle comprises the replication and segregation of genetic material followed by the division of the cell, but in endocycles or syncytial cells nuclear replication or nuclear division may not be followed by cell division."" [GOC:go_curators, GOC:mtg_cell_cycle]",1863,9637,1122,17847,0.11642627373664004,0.6022544283413849,query_1,['GO:0009987']
GO:BP,GO:0006629,lipid metabolic process,1.1668856509248497e-05,True,"""The chemical reactions and pathways involving lipids, compounds soluble in an organic solvent but not, or sparingly, in an aqueous solvent. Includes fatty acids; neutral fats, other fatty-acid esters, and soaps; long-chain (fatty) alcohols and waxes; sphingoids and other long-chain bases; glycolipids, phospholipids and sphingolipids; and carotenes, polyprenols, sterols, terpenes and other isoprenoids."" [GOC:ma]",1409,9637,863,17847,0.08955069004877036,0.6124911284599006,query_1,"['GO:0044238', 'GO:0071704']"
GO:BP,GO:0007018,microtubule-based movement,1.2160299290233029e-05,True,"""A microtubule-based process that results in the movement of organelles, other microtubules, or other cellular components.  Examples include motor-driven movement along microtubules and movement driven by polymerization or depolymerization of microtubules."" [GOC:cjm, ISBN:0815316194]",285,9637,201,17847,0.02085711320950503,0.7052631578947368,query_1,"['GO:0007017', 'GO:0006928']"
GO:MF,GO:0005088,Ras guanyl-nucleotide exchange factor activity,1.3535121988258843e-05,True,"""Stimulates the exchange of guanyl nucleotides associated with a GTPase of the Ras superfamily. Under normal cellular physiological conditions, the concentration of GTP is higher than that of GDP, favoring the replacement of GDP by GTP in association with the GTPase."" [GOC:mah]",139,9902,107,18098,0.010805897798424561,0.7697841726618705,query_1,"['GO:0017016', 'GO:0005085']"
GO:MF,GO:0008509,anion transmembrane transporter activity,1.5100350709247899e-05,True,"""Enables the transfer of a negatively charged ion from one side of a membrane to the other."" [GOC:dgf, GOC:mtg_transport, ISBN:0815340729]",336,9902,232,18098,0.023429610179761664,0.6904761904761905,query_1,['GO:0015075']
GO:BP,GO:0030198,extracellular matrix organization,1.671668641796274e-05,True,"""A process that is carried out at the cellular level which results in the assembly, arrangement of constituent parts, or disassembly of an extracellular matrix."" [GOC:mah]",375,9637,256,17847,0.026564283490712878,0.6826666666666666,query_1,['GO:0043062']
GO:CC,GO:0043025,neuronal cell body,1.733512196501967e-05,True,"""The portion of a neuron that includes the nucleus, but excludes cell projections such as axons and dendrites."" [GOC:go_curators]",506,10070,329,18842,0.032671300893743795,0.650197628458498,query_1,"['GO:0036477', 'GO:0097458', 'GO:0044297']"
GO:CC,GO:0099634,postsynaptic specialization membrane,1.7348316062042156e-05,True,"""The membrane component of the postsynaptic specialization. This is the region of the postsynaptic membrane in which the population of neurotransmitter receptors involved in synaptic transmission are concentrated."" [GOC:dos]",113,10070,88,18842,0.008738828202581926,0.7787610619469026,query_1,"['GO:0097060', 'GO:0099572', 'GO:0045211', 'GO:0044422']"
GO:MF,GO:0045296,cadherin binding,1.81547376528071e-05,True,"""Interacting selectively and non-covalently with cadherin, a type I membrane protein involved in cell adhesion."" [GOC:bf]",330,9902,228,18098,0.023025651383558877,0.6909090909090909,query_1,['GO:0050839']
GO:BP,GO:0015711,organic anion transport,1.9168980413676882e-05,True,"""The directed movement of organic anions into, out of or within a cell, or between cells, by means of some agent such as a transporter or pore. Organic anions are atoms or small molecules with a negative charge which contain carbon in covalent linkage."" [GOC:ai, GOC:krc]",501,9637,332,17847,0.03445055515201826,0.6626746506986028,query_1,"['GO:0071702', 'GO:0006820']"
GO:CC,GO:0044297,cell body,1.9379891014159927e-05,True,"""The portion of a cell bearing surface projections such as axons, dendrites, cilia, or flagella that includes the nucleus, but excludes all cell projections."" [GOC:go_curators]",576,10070,370,18842,0.036742800397219465,0.6423611111111112,query_1,['GO:0044464']
GO:CC,GO:0019897,extrinsic component of plasma membrane,1.96785928845867e-05,True,"""The component of a plasma membrane consisting of gene products and protein complexes that are loosely bound to one of its surfaces, but not integrated into the hydrophobic region."" [GOC:curators, GOC:dos]",161,10070,119,18842,0.011817279046673287,0.7391304347826086,query_1,"['GO:0019898', 'GO:0044459']"
GO:BP,GO:0043547,positive regulation of GTPase activity,1.976172496826804e-05,True,"""Any process that activates or increases the activity of a GTPase."" [GOC:jl, GOC:mah]",405,9637,274,17847,0.028432084673653626,0.6765432098765433,query_1,"['GO:0051345', 'GO:0043087']"
GO:MF,GO:0008047,enzyme activator activity,2.1007789745150028e-05,True,"""Binds to and increases the activity of an enzyme."" [GOC:dph, GOC:mah, GOC:tb]",519,9902,343,18098,0.03463946677438901,0.6608863198458574,query_1,['GO:0030234']
GO:CC,GO:0005783,endoplasmic reticulum,2.1265135935087656e-05,True,"""The irregular network of unit membranes, visible only by electron microscopy, that occurs in the cytoplasm of many eukaryotic cells. The membranes form a complex meshwork of tubular channels, which are often expanded into slitlike cavities called cisternae. The ER takes two forms, rough (or granular), with ribosomes adhering to the outer surface, and smooth (with no ribosomes attached)."" [ISBN:0198506732]",1925,10070,1138,18842,0.11300893743793446,0.5911688311688311,query_1,"['GO:0043231', 'GO:0044444', 'GO:0012505']"
GO:BP,GO:0044087,regulation of cellular component biogenesis,2.2259544420822668e-05,True,"""Any process that modulates the frequency, rate or extent of cellular component biogenesis, a process that results in the biosynthesis of constituent macromolecules, assembly, and arrangement of constituent parts of a cellular component."" [GOC:jl]",946,9637,594,17847,0.061637439037044724,0.627906976744186,query_1,"['GO:0044085', 'GO:0050789']"
GO:CC,GO:0016323,basolateral plasma membrane,2.2300829896302412e-05,True,"""The region of the plasma membrane that includes the basal end and sides of the cell. Often used in reference to animal polarized epithelial membranes, where the basal membrane is the part attached to the extracellular matrix, or in plant cells, where the basal membrane is defined with respect to the zygotic axis."" [GOC:go_curators]",220,10070,156,18842,0.015491559086395233,0.7090909090909091,query_1,['GO:0098590']
GO:MF,GO:0016887,ATPase activity,2.267063391634828e-05,True,"""Catalysis of the reaction: ATP + H2O = ADP + phosphate + 2 H+. May or may not be coupled to another reaction."" [EC:3.6.1.3, GOC:jl]",435,9902,292,18098,0.029488992122803474,0.671264367816092,query_1,['GO:0017111']
GO:BP,GO:0031346,positive regulation of cell projection organization,2.3299182589777104e-05,True,"""Any process that activates or increases the frequency, rate or extent of the process involved in the formation, arrangement of constituent parts, or disassembly of cell projections."" [GOC:mah]",389,9637,264,17847,0.027394417349797653,0.6786632390745502,query_1,"['GO:0051130', 'GO:0031344', 'GO:0030030']"
GO:BP,GO:1901576,organic substance biosynthetic process,2.344932363476154e-05,True,"""The chemical reactions and pathways resulting in the formation of an organic substance, any molecular entity containing carbon."" [GOC:pr, GOC:TermGenie]",6193,9637,3521,17847,0.36536266472968765,0.5685451316001938,query_1,"['GO:0071704', 'GO:0009058']"
GO:MF,GO:0042623,"ATPase activity, coupled",2.6064614787553304e-05,True,"""Catalysis of the reaction: ATP + H2O = ADP + phosphate; this reaction directly drives some other reaction, for example ion transport across a membrane."" [EC:3.6.1.3, GOC:jl]",289,9902,202,18098,0.02039991920824076,0.698961937716263,query_1,['GO:0016887']
GO:CC,GO:0033267,axon part,2.696463564104943e-05,True,"""A part of an axon, a cell projection of a neuron."" [GOC:jl]",388,10070,258,18842,0.025620655412115195,0.6649484536082474,query_1,"['GO:0030424', 'GO:0120038', 'GO:0097458']"
GO:BP,GO:0071310,cellular response to organic substance,3.170690049758211e-05,True,"""Any process that results in a change in state or activity of a cell (in terms of movement, secretion, enzyme production, gene expression, etc.) as a result of an organic substance stimulus."" [GOC:mah]",2788,9637,1639,17847,0.17007367437999377,0.5878766140602583,query_1,"['GO:0010033', 'GO:0070887']"
GO:CC,GO:0005938,cell cortex,3.180143824589762e-05,True,"""The region of a cell that lies just beneath the plasma membrane and often, but not always, contains a network of actin filaments and associated proteins."" [GOC:mah, ISBN:0815316194]",322,10070,218,18842,0.021648460774577955,0.6770186335403726,query_1,"['GO:0099568', 'GO:0071944']"
GO:CC,GO:0034703,cation channel complex,3.232523747399912e-05,True,"""An ion channel complex through which cations pass."" [GOC:mah]",224,10070,158,18842,0.015690168818272097,0.7053571428571429,query_1,['GO:0034702']
GO:BP,GO:0060271,cilium assembly,3.365496576657174e-05,True,"""The assembly of a cilium, a specialized eukaryotic organelle that consists of a filiform extrusion of the cell surface. Each cilium is bounded by an extrusion of the cytoplasmic membrane, and contains a regular longitudinal array of microtubules, anchored basally in a centriole."" [GOC:BHF, GOC:cilia, GOC:dph, GOC:kmv, GOC:pr, GOC:vw, ISBN:0198506732, PMID:13978319, PMID:27350441, Reactome:R-HSA-5617833.2]",367,9637,250,17847,0.025941683096399295,0.6811989100817438,query_1,"['GO:0070925', 'GO:0120031', 'GO:0044782']"
GO:CC,GO:0031256,leading edge membrane,3.442598955844563e-05,True,"""The portion of the plasma membrane surrounding the leading edge of a motile cell."" [GOC:mah]",173,10070,126,18842,0.012512413108242304,0.7283236994219653,query_1,"['GO:0044459', 'GO:0031252']"
GO:BP,GO:0034329,cell junction assembly,3.445088253444284e-05,True,"""A cellular process that results in the aggregation, arrangement and bonding together of a set of components to form a cell junction."" [GOC:mah]",244,9637,174,17847,0.01805541143509391,0.7131147540983607,query_1,"['GO:0034330', 'GO:0022607']"
GO:CC,GO:0005913,cell-cell adherens junction,3.490663489067243e-05,True,"""An adherens junction which connects a cell to another cell."" [GOC:hb]",117,10070,90,18842,0.00893743793445879,0.7692307692307693,query_1,"['GO:0005912', 'GO:0005911']"
GO:MF,GO:0022839,ion gated channel activity,3.7793333414264495e-05,True,"""Enables the transmembrane transfer of a solute by a channel that opens in response to a specific ion stimulus."" [GOC:mtg_transport]",340,9902,233,18098,0.023530599878812362,0.6852941176470588,query_1,"['GO:0022836', 'GO:0015075']"
GO:MF,GO:0016787,hydrolase activity,3.817203375916515e-05,True,"""Catalysis of the hydrolysis of various bonds, e.g. C-O, C-N, C-C, phosphoric anhydride bonds, etc. Hydrolase is the systematic name for any enzyme of EC class 3."" [ISBN:0198506732]",2548,9902,1515,18098,0.15299939406180568,0.5945839874411303,query_1,['GO:0003824']
GO:MF,GO:0044877,protein-containing complex binding,3.965795238351383e-05,True,"""Interacting selectively and non-covalently with a macromolecular complex."" [GOC:jl]",1128,9902,701,18098,0.07079377903453847,0.6214539007092199,query_1,['GO:0005488']
GO:MF,GO:0008270,zinc ion binding,4.009613690220792e-05,True,"""Interacting selectively and non-covalently with zinc (Zn) ions."" [GOC:ai]",829,9902,526,18098,0.05312058170066653,0.6344993968636912,query_1,['GO:0046914']
GO:CC,GO:0019898,extrinsic component of membrane,4.125108716868058e-05,True,"""The component of a membrane consisting of gene products and protein complexes that are loosely bound to one of its surfaces, but not integrated into the hydrophobic region."" [GOC:dos, GOC:jl, GOC:mah]",293,10070,200,18842,0.019860973187686197,0.6825938566552902,query_1,['GO:0044425']
GO:MF,GO:0030020,extracellular matrix structural constituent conferring tensile strength,4.1910951622951816e-05,True,"""A constituent of the extracellular matrix that enables the matrix to resist longitudinal stress."" [GOC:mah, ISBN:0815316194]",41,9902,38,18098,0.0038376085639264795,0.926829268292683,query_1,['GO:0005201']
GO:BP,GO:0009058,biosynthetic process,4.588384330184305e-05,True,"""The chemical reactions and pathways resulting in the formation of substances; typically the energy-requiring part of metabolism in which simpler substances are transformed into more complex ones."" [GOC:curators, ISBN:0198547684]",6295,9637,3573,17847,0.3707585348137387,0.5675933280381255,query_1,['GO:0008152']
GO:BP,GO:0044249,cellular biosynthetic process,5.029807541958373e-05,True,"""The chemical reactions and pathways resulting in the formation of substances, carried out by individual cells."" [GOC:jl]",6102,9637,3467,17847,0.35975926118086543,0.5681743690593248,query_1,"['GO:0044237', 'GO:0009058']"
GO:BP,GO:0016358,dendrite development,5.064462444129377e-05,True,"""The process whose specific outcome is the progression of the dendrite over time, from its formation to the mature structure."" [GOC:aruk, GOC:bc, GOC:jl, ISBN:0198506732, PMID:22683681]",248,9637,176,17847,0.018262944899865102,0.7096774193548387,query_1,"['GO:0048856', 'GO:0031175']"
GO:BP,GO:0050793,regulation of developmental process,5.0668506109450874e-05,True,"""Any process that modulates the frequency, rate or extent of development, the biological process whose specific outcome is the progression of a multicellular organism over time from an initial condition (e.g. a zygote, or a young adult) to a later condition (e.g. a multicellular animal or an aged adult)."" [GOC:go_curators]",2729,9637,1604,17847,0.16644183874649787,0.5877610846463907,query_1,"['GO:0032502', 'GO:0050789']"
GO:BP,GO:0007163,establishment or maintenance of cell polarity,5.274742570338856e-05,True,"""Any cellular process that results in the specification, formation or maintenance of anisotropic intracellular organization or cell growth patterns."" [GOC:mah]",221,9637,159,17847,0.016498910449309952,0.7194570135746606,query_1,['GO:0009987']
GO:MF,GO:0019902,phosphatase binding,5.6905314312955015e-05,True,"""Interacting selectively and non-covalently with any phosphatase."" [GOC:jl]",186,9902,136,18098,0.01373459907089477,0.7311827956989247,query_1,['GO:0019899']
GO:BP,GO:0015849,organic acid transport,5.701043825401053e-05,True,"""The directed movement of organic acids, any acidic compound containing carbon in covalent linkage, into, out of or within a cell, or between cells, by means of some agent such as a transporter or pore."" [ISBN:0198506732]",334,9637,229,17847,0.023762581716301755,0.6856287425149701,query_1,['GO:0071702']
GO:BP,GO:0006836,neurotransmitter transport,5.8222903338922584e-05,True,"""The directed movement of a neurotransmitter into, out of or within a cell, or between cells, by means of some agent such as a transporter or pore. Neurotransmitters are any chemical substance that is capable of transmitting (or inhibiting the transmission of) a nerve impulse from a neuron to another cell."" [GOC:ai]",274,9637,192,17847,0.019923212618034657,0.7007299270072993,query_1,['GO:0006810']
GO:BP,GO:0071705,nitrogen compound transport,5.8752258953175833e-05,True,"""The directed movement of nitrogen-containing compounds into, out of or within a cell, or between cells, by means of some agent such as a transporter or pore."" [CHEBI:51143, GOC:mah]",2466,9637,1456,17847,0.15108436235342948,0.5904298459042985,query_1,['GO:0006810']
GO:BP,GO:0035418,protein localization to synapse,5.992232093951895e-05,True,"""Any process in which a protein is transported to, and/or maintained at the synapse, the junction between a nerve fiber of one neuron and another neuron or muscle fiber or glial cell."" [GOC:bf]",82,9637,68,17847,0.007056137802220608,0.8292682926829268,query_1,['GO:0008104']
GO:CC,GO:0044433,cytoplasmic vesicle part,6.093230085868762e-05,True,"""Any constituent part of cytoplasmic vesicle, a vesicle formed of membrane or protein, found in the cytoplasm of a cell."" [GOC:jl]",1506,10070,899,18842,0.08927507447864945,0.5969455511288181,query_1,"['GO:0031410', 'GO:0044446', 'GO:0044444']"
GO:MF,GO:0022836,gated channel activity,6.569672388842994e-05,True,"""Enables the transmembrane transfer of a solute by a channel that opens in response to a specific stimulus."" [GOC:mtg_transport]",348,9902,237,18098,0.02393455867501515,0.6810344827586207,query_1,['GO:0015267']
GO:MF,GO:1901981,phosphatidylinositol phosphate binding,7.187325347508658e-05,True,"""Interacting selectively and non-covalently with phosphatidylinositol phosphate."" [GOC:TermGenie, PMID:23445487]",160,9902,119,18098,0.012017774187032922,0.74375,query_1,['GO:0035091']
GO:BP,GO:0033554,cellular response to stress,7.240700478722102e-05,True,"""Any process that results in a change in state or activity of a cell (in terms of movement, secretion, enzyme production, gene expression, etc.) as a result of a stimulus indicating the organism is under stress. The stress is usually, but not necessarily, exogenous (e.g. temperature, humidity, ionizing radiation)."" [GOC:mah]",2064,9637,1229,17847,0.12752931410189894,0.5954457364341085,query_1,"['GO:0006950', 'GO:0051716']"
GO:BP,GO:0023056,positive regulation of signaling,7.600497977773128e-05,True,"""Any process that activates, maintains or increases the frequency, rate or extent of a signaling process."" [GOC:mtg_signal]",1882,9637,1126,17847,0.11684134066618242,0.5982996811902231,query_1,"['GO:0048518', 'GO:0023051', 'GO:0023052']"
GO:BP,GO:0030001,metal ion transport,8.00227912237434e-05,True,"""The directed movement of metal ions, any metal ion with an electric charge, into, out of or within a cell, or between cells, by means of some agent such as a transporter or pore."" [GOC:ai]",919,9637,575,17847,0.059665871121718374,0.6256800870511425,query_1,['GO:0006812']
